{
  "schemaVersion": 1,
  "id": "reference-style-ten",
  "title": "Reference style ten round pack",
  "provenance": "Ten manually traced Hadski Gaming video formations, revised after frame-by-frame review. Not extracted original game data.",
  "rulesProfile": "classic-observed-v1",
  "levels": [
    {
      "id": "ref-01",
      "name": "Pair and singleton",
      "boardSize": 5,
      "provenance": "Manually traced from Hadski Gaming 2SR6dQM1BDc at 324s; grid coordinates rechecked 2026-10-13. Timing and motion path remain approximate.",
      "boxes": [
        {
          "id": "b1",
          "x": 2,
          "y": 3,
          "z": 0,
          "w": 1,
          "d": 1,
          "h": 1
        },
        {
          "id": "b2",
          "x": 2,
          "y": 2,
          "z": 0,
          "w": 1,
          "d": 1,
          "h": 1
        },
        {
          "id": "b3",
          "x": 2,
          "y": 0,
          "z": 0,
          "w": 1,
          "d": 1,
          "h": 1
        }
      ],
      "presentation": {
        "kind": "static",
        "durationMs": 750
      },
      "revealOrder": [
        "b1",
        "b2",
        "b3"
      ]
    },
    {
      "id": "ref-02",
      "name": "Five and one",
      "boardSize": 5,
      "provenance": "Manually traced from Hadski Gaming 2SR6dQM1BDc at 329s; grid coordinates rechecked 2026-10-13. Timing and motion path remain approximate.",
      "boxes": [
        {
          "id": "b1",
          "x": 1,
          "y": 1,
          "z": 0,
          "w": 1,
          "d": 1,
          "h": 1
        },
        {
          "id": "b2",
          "x": 2,
          "y": 1,
          "z": 0,
          "w": 1,
          "d": 1,
          "h": 1
        },
        {
          "id": "b3",
          "x": 1,
          "y": 2,
          "z": 0,
          "w": 1,
          "d": 1,
          "h": 1
        },
        {
          "id": "b4",
          "x": 2,
          "y": 2,
          "z": 0,
          "w": 1,
          "d": 1,
          "h": 1
        },
        {
          "id": "b5",
          "x": 3,
          "y": 2,
          "z": 0,
          "w": 1,
          "d": 1,
          "h": 1
        },
        {
          "id": "b6",
          "x": 4,
          "y": 1,
          "z": 0,
          "w": 1,
          "d": 1,
          "h": 1
        }
      ],
      "presentation": {
        "kind": "static",
        "durationMs": 750
      },
      "revealOrder": [
        "b1",
        "b2",
        "b3",
        "b4",
        "b5",
        "b6"
      ]
    },
    {
      "id": "ref-03",
      "name": "Short towers",
      "boardSize": 5,
      "provenance": "Manually traced from Hadski Gaming 2SR6dQM1BDc at 336.1s; grid coordinates rechecked 2026-10-13. Timing and motion path remain approximate.",
      "boxes": [
        {
          "id": "b1",
          "x": 0,
          "y": 4,
          "z": 0,
          "w": 1,
          "d": 1,
          "h": 1
        },
        {
          "id": "b2",
          "x": 0,
          "y": 4,
          "z": 1,
          "w": 1,
          "d": 1,
          "h": 1
        },
        {
          "id": "b3",
          "x": 4,
          "y": 0,
          "z": 0,
          "w": 1,
          "d": 1,
          "h": 1
        },
        {
          "id": "b4",
          "x": 4,
          "y": 0,
          "z": 1,
          "w": 1,
          "d": 1,
          "h": 1
        },
        {
          "id": "b5",
          "x": 0,
          "y": 0,
          "z": 0,
          "w": 1,
          "d": 1,
          "h": 1
        }
      ],
      "presentation": {
        "kind": "static",
        "durationMs": 750
      },
      "revealOrder": [
        "b1",
        "b2",
        "b3",
        "b4",
        "b5"
      ]
    },
    {
      "id": "ref-04",
      "name": "Travelling gap and branch",
      "boardSize": 5,
      "provenance": "Manually traced from Hadski Gaming 2SR6dQM1BDc at 349.25s; grid coordinates rechecked 2026-10-13. Timing and motion path remain approximate.",
      "boxes": [
        {
          "id": "b1",
          "x": 1,
          "y": 0,
          "z": 0,
          "w": 1,
          "d": 1,
          "h": 1
        },
        {
          "id": "b2",
          "x": 1,
          "y": 1,
          "z": 0,
          "w": 1,
          "d": 1,
          "h": 1
        },
        {
          "id": "b3",
          "x": 1,
          "y": 2,
          "z": 0,
          "w": 1,
          "d": 1,
          "h": 1
        },
        {
          "id": "b4",
          "x": 1,
          "y": 4,
          "z": 0,
          "w": 1,
          "d": 1,
          "h": 1
        },
        {
          "id": "b5",
          "x": 2,
          "y": 3,
          "z": 0,
          "w": 1,
          "d": 1,
          "h": 1
        }
      ],
      "presentation": {
        "kind": "travel",
        "durationMs": 1200,
        "from": {
          "x": 1050,
          "y": -520
        },
        "to": {
          "x": -1050,
          "y": 520
        }
      },
      "revealOrder": [
        "b1",
        "b2",
        "b3",
        "b4",
        "b5"
      ]
    },
    {
      "id": "ref-05",
      "name": "One broad box",
      "boardSize": 5,
      "provenance": "Manually traced from Hadski Gaming 2SR6dQM1BDc at 351.95s; grid coordinates rechecked 2026-10-13. Timing and motion path remain approximate.",
      "boxes": [
        {
          "id": "b1",
          "x": 0,
          "y": 1,
          "z": 0,
          "w": 2,
          "d": 2,
          "h": 1
        },
        {
          "id": "b2",
          "x": 2,
          "y": 1,
          "z": 0,
          "w": 1,
          "d": 1,
          "h": 1
        },
        {
          "id": "b3",
          "x": 2,
          "y": 2,
          "z": 0,
          "w": 1,
          "d": 1,
          "h": 1
        },
        {
          "id": "b4",
          "x": 0,
          "y": 4,
          "z": 0,
          "w": 1,
          "d": 1,
          "h": 1
        }
      ],
      "presentation": {
        "kind": "static",
        "durationMs": 750
      },
      "revealOrder": [
        "b1",
        "b2",
        "b3",
        "b4"
      ]
    },
    {
      "id": "ref-06",
      "name": "Travelling towers",
      "boardSize": 5,
      "provenance": "Manually traced from Hadski Gaming 2SR6dQM1BDc at 358.5s; grid coordinates rechecked 2026-10-13. Timing and motion path remain approximate.",
      "boxes": [
        {
          "id": "b1",
          "x": 0,
          "y": 3,
          "z": 0,
          "w": 1,
          "d": 1,
          "h": 1
        },
        {
          "id": "b2",
          "x": 0,
          "y": 3,
          "z": 1,
          "w": 1,
          "d": 1,
          "h": 1
        },
        {
          "id": "b3",
          "x": 0,
          "y": 3,
          "z": 2,
          "w": 1,
          "d": 1,
          "h": 1
        },
        {
          "id": "b4",
          "x": 0,
          "y": 3,
          "z": 3,
          "w": 1,
          "d": 1,
          "h": 1
        },
        {
          "id": "b5",
          "x": 4,
          "y": 0,
          "z": 0,
          "w": 1,
          "d": 1,
          "h": 1
        },
        {
          "id": "b6",
          "x": 4,
          "y": 0,
          "z": 1,
          "w": 1,
          "d": 1,
          "h": 1
        },
        {
          "id": "b7",
          "x": 0,
          "y": 0,
          "z": 0,
          "w": 1,
          "d": 1,
          "h": 1
        }
      ],
      "presentation": {
        "kind": "travel",
        "durationMs": 1200,
        "from": {
          "x": 1050,
          "y": -520
        },
        "to": {
          "x": -1050,
          "y": 520
        }
      },
      "revealOrder": [
        "b1",
        "b2",
        "b3",
        "b4",
        "b5",
        "b6",
        "b7"
      ]
    },
    {
      "id": "ref-07",
      "name": "Two rows",
      "boardSize": 5,
      "provenance": "Manually traced from Hadski Gaming 2SR6dQM1BDc at 366.7s; grid coordinates rechecked 2026-10-13. Timing and motion path remain approximate.",
      "boxes": [
        {
          "id": "b1",
          "x": 1,
          "y": 0,
          "z": 0,
          "w": 1,
          "d": 1,
          "h": 1
        },
        {
          "id": "b2",
          "x": 2,
          "y": 0,
          "z": 0,
          "w": 1,
          "d": 1,
          "h": 1
        },
        {
          "id": "b3",
          "x": 3,
          "y": 0,
          "z": 0,
          "w": 1,
          "d": 1,
          "h": 1
        },
        {
          "id": "b4",
          "x": 4,
          "y": 0,
          "z": 0,
          "w": 1,
          "d": 1,
          "h": 1
        },
        {
          "id": "b5",
          "x": 1,
          "y": 3,
          "z": 0,
          "w": 1,
          "d": 1,
          "h": 1
        },
        {
          "id": "b6",
          "x": 2,
          "y": 3,
          "z": 0,
          "w": 1,
          "d": 1,
          "h": 1
        },
        {
          "id": "b7",
          "x": 3,
          "y": 3,
          "z": 0,
          "w": 1,
          "d": 1,
          "h": 1
        },
        {
          "id": "b8",
          "x": 4,
          "y": 3,
          "z": 0,
          "w": 1,
          "d": 1,
          "h": 1
        }
      ],
      "presentation": {
        "kind": "static",
        "durationMs": 750
      },
      "revealOrder": [
        "b1",
        "b2",
        "b3",
        "b4",
        "b5",
        "b6",
        "b7",
        "b8"
      ]
    },
    {
      "id": "ref-08",
      "name": "Corner flash",
      "boardSize": 5,
      "provenance": "Manually traced from Hadski Gaming 2SR6dQM1BDc at 375.5s; grid coordinates rechecked 2026-10-13. Timing and motion path remain approximate.",
      "boxes": [
        {
          "id": "b1",
          "x": 1,
          "y": 2,
          "z": 0,
          "w": 1,
          "d": 1,
          "h": 1
        },
        {
          "id": "b2",